{
  "$schema": "https://adjective.us/prelude/schemas/v1/stack.schema.json",
  "version": "1.0.0",
  "language": "TypeScript/JavaScript",
  "runtime": "Node.js >=20.19.0",
  "packageManager": "pnpm",
  "dependencies": {
    "@modelcontextprotocol/sdk": "^1.32.1",
    "cac": "^7.1.0",
    "chokidar": "^5.0.0",
    "colorette": "^2.0.20",
    "log-symbols": "^7.0.1",
    "zod": "^4.6.7"
  },
  "devDependencies": {
    "@eslint/js": "^10.0.1",
    "@types/node": "^26.6.5",
    "eslint": "^10.13.0",
    "prettier": "^3.9.10",
    "tsx": "^4.23.15",
    "typescript": "^6.0.3",
    "typescript-eslint": "^8.71.2",
    "vite": "^8.3.4",
    "vitest": "^5.0.5"
  },
  "frameworks": [],
  "buildTools": [
    "Vite"
  ],
  "testingFrameworks": [
    "Vitest"
  ],
  "styling": [],
  "cicd": [
    "GitHub Actions"
  ]
}